{
  "schemaVersion": "1.3",
  "meta": {
    "id": "agent-field-update",
    "title": "Agent field update fixture"
  },
  "entities": {
    "alice": {
      "kind": "person",
      "name": "Alice",
      "summary": "summary-new"
    }
  },
  "aliases": {
    "Alice": "alice"
  },
  "stages": [
    {
      "key": "main",
      "name": "Main",
      "entities": [
        "alice"
      ]
    }
  ]
}
