{
  "schemaVersion": "1.3",
  "meta": {
    "id": "agent-alias-relation",
    "title": "Agent alias and relation fixture"
  },
  "entities": {
    "alice": {
      "kind": "person",
      "name": "Alice"
    },
    "bob": {
      "kind": "person",
      "name": "Bob"
    }
  },
  "aliases": {
    "Alice": "alice",
    "Bob": "bob"
  },
  "relationTypes": {
    "friend": {
      "label": "Friend"
    }
  },
  "relations": [],
  "stages": [
    {
      "key": "main",
      "name": "Main",
      "entities": [
        "alice",
        "bob"
      ],
      "relations": []
    }
  ]
}
